{
  "format": "alerttime-teacher-sync",
  "schemaVersion": 1,
  "messageType": "pair",
  "deviceId": "f0a24c19-0f8e-4b6d-9a3c-77e1b2d4c5a6",
  "generatedAt": 1785600100000,
  "appVersion": "0.1.0",
  "protocolCapabilities": { "fullSnapshotV1": true, "proposalsV1": true },
  "cursor": null,
  "payload": {
    "token": "p8Kj2mQx9vLz4nWb6tFh1sDg5rYc7uEa",
    "deviceId": "f0a24c19-0f8e-4b6d-9a3c-77e1b2d4c5a6",
    "ownerIdentity": "1b7a3c5e-9f0d-4a2c-8e6b-5d4c3b2a1f90"
  }
}
